reports/tables/extension_small_dataset_analysis.json

[
    {
        "proportion": 0.2,
        "Cox PH": 0.4452,
        "RSF": 0.4486,
        "DeepSurv": 0.3926,
        "Bayesian Cox": 0.5368
    },
    {
        "proportion": 0.4,
        "Cox PH": 0.4786,
        "RSF": 0.4876,
        "DeepSurv": 0.405,
        "Bayesian Cox": 0.5492
    },
    {
        "proportion": 0.6,
        "Cox PH": 0.4435,
        "RSF": 0.4756,
        "DeepSurv": 0.4409,
        "Bayesian Cox": 0.5394
    },
    {
        "proportion": 0.8,
        "Cox PH": 0.4756,
        "RSF": 0.4722,
        "DeepSurv": 0.4824,
        "Bayesian Cox": 0.5415
    },
    {
        "proportion": 1.0,
        "Cox PH": 0.482,
        "RSF": 0.5188,
        "DeepSurv": 0.5634,
        "Bayesian Cox": 0.5244
    }
]

cmd_exec.md

Training with 20.0% of GBSG2 training dataset...
Finished [100%]: Average Loss = 3.5224e+05
    -> Results (C-index) at 20.0% training size: Cox PH=0.4452, RSF=0.4486, DeepSurv=0.3926, Bayesian Cox=0.5368
  Training with 40.0% of GBSG2 training dataset...
Finished [100%]: Average Loss = 4.9339e+05
    -> Results (C-index) at 40.0% training size: Cox PH=0.4786, RSF=0.4876, DeepSurv=0.4050, Bayesian Cox=0.5492
  Training with 60.0% of GBSG2 training dataset...
Finished [100%]: Average Loss = 1.0176e+06
    -> Results (C-index) at 60.0% training size: Cox PH=0.4435, RSF=0.4756, DeepSurv=0.4409, Bayesian Cox=0.5394
  Training with 80.0% of GBSG2 training dataset...
Finished [100%]: Average Loss = 1.4207e+06
    -> Results (C-index) at 80.0% training size: Cox PH=0.4756, RSF=0.4722, DeepSurv=0.4824, Bayesian Cox=0.5415
  Training with 100.0% of GBSG2 training dataset...
Finished [100%]: Average Loss = 3.3341e+07
    -> Results (C-index) at 100.0% training size: Cox PH=0.4820, RSF=0.5188, DeepSurv=0.5634, Bayesian Cox=0.5244
  [+] Saved line plot to: /home/loverboy/Downloads/Personal/Bayesian COX/reports/figures/extension_small_dataset_analysis.png